,catagory,sub_cata_1,sub_cata_2,product,price,review,review_num
0,Women's Clothes,Pants,Leggings,"lululemon Align™ High-Rise Mini Flared Pant 32""",128.0,3.9,584
1,Women's Clothes,Coats & Jackets,,Quilted Light Insulation Jacket,228.0,3.8,63
2,Women's Clothes,Shirts,Long Sleeve Shirts,Back in Action Long-Sleeve Shirt Nulu,78.0,4.4,275
3,Women's Clothes,Hoodies & Sweatshirts,,Scuba Oversized Funnel Neck Half Zip,118.0,4.5,1704
4,Women's Clothes,Pants,Leggings,"lululemon Align™ High-Rise Pant 25""",98.0,,0
5,Women's Clothes,Hoodies & Sweatshirts,,Define Jacket Luon,128.0,4.4,5623
6,Women's Clothes,Hoodies & Sweatshirts,,Scuba Oversized Half-Zip Hoodie,118.0,4.4,5367
7,Women's Clothes,Pants,Sweatpants,Scuba High-Rise Jogger Full Length,128.0,3.6,1477
8,Women's Clothes,Pants,Leggings,"lululemon Align™ High-Rise Pant 28""",98.0,3.5,15768
9,Women's Clothes,Shirts,Tank Tops,lululemon Align™ Waist-Length Tank Top,68.0,3.9,667
10,Women's Clothes,Shirts,Tank Tops,lululemon Align™ Tank Top,68.0,4.2,5393
11,Women's Clothes,Pants,Joggers,Dance Studio Mid-Rise Jogger Full Length,98.0,4.1,3579
12,Women's Clothes,Hoodies & Sweatshirts,,Scuba Full-Zip Hoodie,118.0,4.1,4346
13,Women's Clothes,Pants,Leggings,"lululemon Align™ Super-High-Rise Pant 28"" Online Only",98.0,4.1,922
14,Women's Clothes,Pants,Sweatpants,Softstreme High-Rise Pant Full Length,138.0,4.1,494
15,Women's Clothes,Shorts,,"lululemon Align™ High-Rise Short 6""",64.0,4.3,3070
16,Women's Clothes,Hoodies & Sweatshirts,,Nulu Cropped Define Jacket,128.0,4.4,495
17,Women's Clothes,Pants,Leggings,"lululemon Align™ High-Rise Crop 23""",88.0,3.8,2164
18,Shoes,,,Restfeel Women's Slide,68.0,4.3,505
19,Women's Clothes,Sweaters,,Softstreme Belted Wrap,148.0,4.0,166
20,Women's Clothes,Pants,Leggings,"lululemon Align™ V-Waist Pant 25"" Online Only",128.0,4.2,78
21,Women's Clothes,Pants,Sweatpants,lululemon Align™ High-Rise Jogger Full Length,118.0,3.8,5018
22,Women's Clothes,Pants,Leggings,"lululemon Align™ Ribbed High-Rise Pant 28""",128.0,4.1,176
23,Women's Clothes,Hoodies & Sweatshirts,,Perfectly Oversized Cropped Crew Softstreme,128.0,3.4,1020
24,Women's Clothes,Sports Bras,,"lululemon Align™ Reversible Bra Light Support, A/B Cup",58.0,4.4,566
25,Women's Clothes,Pants,Leggings,"lululemon Align™ Ribbed High-Rise Pant 25""",128.0,4.1,312
26,Women's Clothes,Pants,Trousers,Stretch High-Rise Pant 7/8 Length,128.0,4.1,623
27,Women's Clothes,Hoodies & Sweatshirts,,Scuba Oversized Full Zip Hoodie,128.0,4.4,1403
28,Women's Clothes,Shirts,,lululemon Align™ High-Neck Tank Top,68.0,4.3,442
29,Women's Clothes,Pants,Leggings,"Wunder Train High-Rise Tight 25""",98.0,4.1,6102
30,Women's Clothes,Pants,Leggings,Groove Super-High-Rise Flared Pant Nulu,128.0,4.0,3885
31,Women's Clothes,Shorts,,"Hotty Hot Low-Rise Lined Short 2.5""",68.0,4.3,4050
32,Women's Clothes,Sports Bras,,"Like a Cloud Longline Bra Light Support, B/C Cup",74.0,4.3,558
33,Women's Clothes,Shirts,Tank Tops,lululemon Align™ Waist-Length Racerback Tank Top,58.0,4.4,375
34,Women's Clothes,Shirts,Long Sleeve Shirts,Swiftly Tech Long-Sleeve Shirt 2.0 Race Length,78.0,4.4,1367
35,Women's Clothes,Sports Bras,,"lululemon Energy Longline Bra Medium Support, B–D Cups",64.0,4.0,1918
36,Women's Clothes,Sports Bras,,"Like a Cloud Longline Bra Light Support, D/DD Cup",74.0,4.6,381
37,Women's Clothes,Pants,Leggings,"Wunder Train High-Rise Crop 23""",88.0,4.1,882
38,Women's Clothes,Shorts,,"Wunder Train High-Rise Short 4"" Online Only",64.0,3.9,265
39,Women's Clothes,Shorts,,"Speed Up Mid-Rise Lined Short 4""",68.0,4.3,662
40,Women's Clothes,Sports Bras,,"Free to Be Elevated Bra Light Support, DD/DDD(E) Cup Online Only",54.0,4.1,608
41,Women's Clothes,Sports Bras,,"Free to Be Serene Bra Light Support, C/D Cup Online Only",54.0,4.2,1284
42,Women's Clothes,Shirts,T-Shirts,Back in Action Short-Sleeve T-Shirt,58.0,4.1,580
43,Women's Clothes,Pants,Leggings,"lululemon Align™ High-Rise Crop 17"" Online Only",88.0,4.2,546
44,Women's Clothes,Pants,Leggings,"lululemon Align™ High-Rise Crop with Pockets 23""",128.0,4.1,441
45,Women's Clothes,Shirts,Long Sleeve Shirts,Back in Action Long-Sleeve Shirt,68.0,3.9,1503
46,Women's Clothes,Hoodies & Sweatshirts,,Define Jacket Nulu,128.0,4.4,17
47,Women's Clothes,Shirts,Tank Tops,Hold Tight Tank Top,48.0,4.0,206
48,Women's Clothes,Sports Bras,,"Enlite Front-Zip Bra High Support, A–DDD(E) Cups Online Only",108.0,3.4,1690
49,Women's Clothes,Hoodies & Sweatshirts,,Hooded Define Jacket Nulu,138.0,4.3,2356
50,Women's Clothes,Pants,Leggings,"lululemon Align™ High-Rise Wide Leg Crop 23"" Online Only",128.0,4.4,74
51,Women's Clothes,Shirts,Short Sleeve Shirts,Swiftly Tech Short-Sleeve Shirt 2.0 Race Length,68.0,4.4,625
52,Women's Clothes,Underwear,,InvisiWear Mid-Rise Bikini Underwear 5 Pack,74.0,2.4,61
53,Women's Clothes,Underwear,,InvisiWear Mid-Rise Thong Underwear 5 Pack,74.0,2.4,119
54,Women's Clothes,Shirts,Short Sleeve Shirts,Hold Tight Short-Sleeve Shirt,58.0,4.2,100
55,Women's Clothes,Sports Bras,,"Like a Cloud Ribbed Bra Light Support, B/C Cup",64.0,4.5,33
56,Women's Clothes,Sports Bras,,"lululemon Align™ Bra Light Support, C/D Cup",58.0,4.5,173
57,Women's Clothes,Shirts,Tank Tops,Sculpt Cropped Tank Top,58.0,4.4,274
58,Women's Clothes,Underwear,,UnderEase Mid-Rise Thong Underwear 3 Pack,48.0,3.3,116
59,Women's Clothes,Underwear,,UnderEase Mid-Rise Bikini Underwear 3 Pack,48.0,3.8,102
60,Women's Clothes,Shirts,T-Shirts,Train to Be Short-Sleeve Shirt,68.0,4.1,90
61,Women's Clothes,Shorts,,"Wunder Train Contour Fit High-Rise Short 4"" Online Only",64.0,3.9,72
62,Women's Clothes,Pants,Leggings,"Wunder Train Contour Fit High-Rise Tight 25""",98.0,4.2,411
63,,,,Scuba Full-Zip Cropped Hoodie,118.0,5.0,1
64,Women's Clothes,Shirts,Long Sleeve Shirts,Waterside Relaxed UV Protection Long Sleeve,84.0,3.6,65
65,Women's Clothes,Pants,Capris,Dance Studio Mid-Rise Cropped Pants,88.0,4.3,231
66,Women's Clothes,Shirts,Long Sleeve Shirts,All It Takes Long-Sleeve Shirt Nulu,68.0,4.6,8
67,Women's Clothes,Sports Bras,,"Ribbed Nulu Asymmetrical Yoga Bra Light Support, A/B Cup",64.0,4.3,172
68,Women's Clothes,Shorts,,"Dance Studio High-Rise Short 3.5"" Online Only",68.0,4.3,22
69,Women's Clothes,Sweaters,,Cotton-Blend Mock Neck Sweater,128.0,,0
70,Women's Clothes,Sports Bras,,"Everlux Mesh-Back Train Bra Light Support, C/D Cup Online Only",74.0,,0
71,Women's Clothes,Shirts,Long Sleeve Shirts,Hold Tight Long-Sleeve Shirt,68.0,4.3,415
72,Women's Clothes,Shirts,T-Shirts,Asymmetrical Ribbed Cotton T-Shirt,88.0,,0
73,Women's Clothes,Shirts,,Asymmetrical Ribbed Cotton Long-Sleeve Shirt,98.0,5.0,2
74,Women's Clothes,Shirts,Bodysuits,"Ribbed Contoured Unitard 6"" Online Only",138.0,4.0,21
75,Women's Clothes,Shirts,Tank Tops,Strappy Nulu Shelf Tank Top,68.0,4.5,70
76,Women's Clothes,Shorts,,SenseKnit Composite High-Rise Running Short,158.0,,0
77,Women's Clothes,Shirts,T-Shirts,Heavyweight Cotton Mock-Neck T-Shirt,98.0,,0
78,Women's Clothes,Sports Bras,,"Like a Cloud High-Neck Longline Ribbed Bra Light Support, B/C Cup Online Only",74.0,,0
79,Women's Clothes,Coats & Jackets,,Push Your Pace Jacket,198.0,,0
80,Women's Clothes,Shirts,T-Shirts,Team Canada All Yours T-Shirt Online Only,58.0,4.0,1
81,Women's Clothes,Sports Bras,,Ribbed Nulu High-Neck Yoga Bra,74.0,4.2,10
82,Women's Clothes,Pants,Trousers,"Stretch High-Rise Cropped Pants 23"" Online Only",108.0,4.3,145
83,Women's Clothes,Shirts,Bodysuits,Tight-Fit Long-Sleeve Knit Bodysuit,128.0,3.2,17
84,Women's Clothes,Swimsuits,,"Waterside Square-Neck One-Piece Swimsuit B/C Cup, Medium Bum Coverage",138.0,3.6,40
85,Women's Clothes,Swimsuits,,Waterside High-Cut Super-High-Rise Swim Bottom Medium Bum Coverage,74.0,3.4,7
86,Women's Clothes,Shorts,,"Hotty Hot Low-Rise Lined Short 4""",68.0,4.3,1193
87,Women's Clothes,Shorts,,"Speed Up Low-Rise Lined Short 2.5""",68.0,4.1,2989
88,Women's Clothes,Shorts,,"Hotty Hot High-Rise Lined Short 4""",58.0,4.3,1635
89,Women's Clothes,Shorts,,"Hotty Hot High-Rise Lined Short 2.5""",68.0,4.6,1745
90,Women's Clothes,Shorts,,"Speed Up High-Rise Lined Short 4""",68.0,4.4,796
91,Women's Clothes,Skirts,,Pace Rival Mid-Rise Skirt Online Only,78.0,4.6,482
92,Women's Clothes,Pants,Joggers,Ready to Rulu High-Rise Jogger Full Length,118.0,4.2,205
93,Women's Clothes,Skirts,,Pace Rival Mid-Rise Skirt Long,78.0,4.4,597
94,Women's Clothes,Sports Bras,,"Like a Cloud Bra Light Support, B/C Cup",64.0,,0
95,Women's Clothes,Shorts,,"lululemon Align™ High-Rise Short 8"" Online Only",64.0,4.2,1276
96,Women's Clothes,Shorts,,"Speed Up High-Rise Lined Short 2.5""",58.0,4.5,382
97,Women's Clothes,Pants,Leggings,"Fast and Free High-Rise Tight 25""",138.0,3.7,4469
98,Women's Clothes,Pants,Leggings,"lululemon Align™ High-Rise Pant with Pockets 25""",128.0,3.9,1872
99,Women's Clothes,Shirts,T-Shirts,Love Crewneck T-Shirt,48.0,3.8,573
100,Women's Clothes,Shorts,,"Track That Mid-Rise Lined Short 5""",68.0,4.4,2593
101,Women's Clothes,Shirts,Short Sleeve Shirts,Classic-Fit Cotton-Blend T-Shirt,58.0,4.3,278
102,Women's Clothes,Shirts,Tank Tops,Love Tank Top,38.0,4.1,620
103,Women's Clothes,Shirts,,All Yours Cotton Long-Sleeve Shirt,68.0,4.5,228
104,Women's Clothes,Sports Bras,,"lululemon Energy Bra Medium Support, B–D Cups",54.0,3.9,922
105,Women's Clothes,Pants,Leggings,"Wunder Train High-Rise Tight 28""",98.0,4.1,1349
106,Women's Clothes,Pants,Leggings,"Wunder Train High-Rise Tight with Pockets 25""",138.0,4.2,260
107,Women's Clothes,Sports Bras,,"Flow Y Nulu Bra Light Support, A–C Cups",52.0,3.7,1806
108,Women's Clothes,Sports Bras,,"Free to Be Bra - Wild Light Support, A/B Cup",52.0,4.1,466
109,Women's Clothes,Shirts,Short Sleeve Shirts,All Yours Cotton T-Shirt,58.0,4.0,458
110,Women's Clothes,Hoodies & Sweatshirts,,It's Rulu Run Cropped Half Zip,108.0,4.1,223
111,Women's Clothes,Shirts,Tank Tops,Ebb to Street Cropped Racerback Tank Top,68.0,3.7,544
112,Women's Clothes,Shirts,T-Shirts,Swiftly Tech Short-Sleeve Shirt 2.0,68.0,4.4,2243
113,Women's Clothes,Shorts,,"Wunder Train High-Rise Short 6""",64.0,4.0,1646
114,Women's Clothes,Shirts,T-Shirts,High-Neck Running and Training T-Shirt,58.0,3.9,460
115,Women's Clothes,Pants,Leggings,"lululemon Align™ High-Rise Crop 21""",88.0,,0
116,Women's Clothes,Sports Bras,,"Like a Cloud Ribbed Longline Bra Light Support, B/C Cup",74.0,4.6,45
117,Women's Clothes,Shirts,,Classic-Fit Cotton-Blend Long-Sleeve Shirt,68.0,4.3,127
118,Women's Clothes,Shirts,Long Sleeve Shirts,It's Rulu Run Long-Sleeve Shirt,98.0,4.2,346
119,Women's Clothes,Shirts,Tank Tops,Train to Be Tank Top,58.0,,0
120,Women's Clothes,Shorts,,"Track That High-Rise Lined Short 5"" Online Only",68.0,4.4,86
121,Shoes,,,Chargefeel Low Women's Workout Shoe,178.0,4.5,864
122,Women's Clothes,Sports Bras,,"lululemon Align™ Ribbed Bra Light Support, A/B Cup",58.0,,0
123,Women's Clothes,Pants,Leggings,"lululemon Align™ High-Rise Pant with Pockets 28"" Online Only",138.0,4.2,370
124,Women's Clothes,Shirts,Tank Tops,All Yours Tank Top Online Only,44.0,3.7,205
125,Women's Clothes,Shirts,Long Sleeve Shirts,Swiftly Tech Long-Sleeve Shirt 2.0,78.0,4.1,1952
126,Women's Clothes,Pants,Leggings,"Swift Speed High-Rise Tight 28""",138.0,4.0,1018
127,Shoes,,,Strongfeel Women's Training Shoe,168.0,4.4,202
128,Women's Clothes,Shorts,,"Wunder Train High-Rise Short 8"" Online Only",64.0,3.9,503
129,Women's Clothes,Pants,Leggings,"Base Pace High-Rise Tight 25""",98.0,4.0,1136
130,Women's Clothes,Shorts,,"lululemon Align™ High-Rise Short 4"" Online Only",64.0,4.2,1179
131,Women's Clothes,Shirts,Long Sleeve Shirts,Swiftly Relaxed Long-Sleeve Shirt,78.0,4.4,931
132,Women's Clothes,Skirts,,Court Rival High-Rise Skirt,88.0,3.8,551
133,Women's Clothes,Pants,,Smooth Fit Pull-On High-Rise Pants,158.0,3.6,13
134,Women's Clothes,Shirts,Tank Tops,Classic-Fit Cotton-Blend Tank Top,48.0,4.2,87
135,Women's Clothes,Shorts,,"Tracker Low-Rise Lined Short 4""",58.0,4.1,2337
136,Women's Clothes,Shirts,Tank Tops,Ebb to Street Tank Top,68.0,4.2,1140
137,Women's Clothes,Skirts,,Court Rival High-Rise Skirt Long,88.0,4.3,397
138,Women's Clothes,Underwear,,UnderEase Mid-Rise Bikini Underwear 5 Pack,74.0,4.0,58
139,Women's Clothes,Shirts,T-Shirts,Quick-Dry Short-Sleeve Polo Shirt,78.0,4.5,137
140,Women's Clothes,Pants,Sweatpants,Scuba High-Rise French Terry Jogger Full Length,128.0,4.1,147
141,Women's Clothes,Shirts,Long Sleeve Shirts,High-Neck Running and Training Long-Sleeve Shirt,68.0,3.9,182
142,Women's Clothes,Sports Bras,,"lululemon Energy Bra High Support, B–DDD Cups",64.0,3.7,819
143,Women's Clothes,Sports Bras,,"Run Times Bra High Support, B–G Cups",74.0,4.1,1541
144,Women's Clothes,Shirts,T-Shirts,Ebb to Street Short-Sleeve Shirt,78.0,4.0,53
145,Women's Clothes,Underwear,,UnderEase Mid-Rise Thong Underwear,18.0,3.9,63
146,Women's Clothes,Shirts,Tank Tops,Quick-Dry Sleeveless Polo Shirt,68.0,4.0,70
147,Women's Clothes,Shirts,Tank Tops,Swiftly Tech Racerback Tank Top 2.0 Race Length,58.0,4.4,961
148,Women's Clothes,Shirts,Tank Tops,lululemon Align™ Hip-Length Racerback Tank Top,58.0,4.4,319
149,Women's Clothes,Underwear,,UnderEase Mid-Rise Thong Underwear 5 Pack,74.0,3.8,82
150,Women's Clothes,Dresses,,Classic-Fit Cotton-Blend Dress,88.0,3.9,109
151,Women's Clothes,Pants,Leggings,"Base Pace High-Rise Tight 28""",98.0,4.0,377
152,Women's Clothes,Sports Bras,,"lululemon Energy Longline Bra Ribbed Luxtreme Medium Support, B–D Cups",64.0,3.6,226
153,Women's Clothes,Sports Bras,,"Wunder Train Longline Bra Medium Support, C/D Cup",74.0,3.7,424
154,Women's Clothes,Shirts,Tank Tops,Invigorate Training Tank Top,68.0,4.3,373
155,Women's Clothes,Pants,Leggings,"Wunder Train High-Rise Crop 21""",88.0,4.1,982
156,Women's Clothes,Underwear,,InvisiWear Mid-Rise Thong Underwear 3 Pack,48.0,2.5,164
157,Women's Clothes,Shirts,T-Shirts,All It Takes Short-Sleeve Shirt Nulu,58.0,4.5,115
158,Women's Clothes,Shirts,Tank Tops,Swiftly Tech Racerback Tank Top 2.0,58.0,3.9,973
159,Women's Clothes,Shorts,,"lululemon Align™ High-Rise Short with Pockets 8"" Online Only",74.0,4.2,287
160,Women's Clothes,Sports Bras,,"Like a Cloud High-Neck Longline Bra Light Support, B/C Cup Online Only",74.0,4.3,172
161,Women's Clothes,Shorts,,"Base Pace High-Rise Short 8"" Online Only",64.0,3.7,193
162,Women's Clothes,Pants,Joggers,Ready to Rulu Classic-Fit High-Rise Jogger 7/8 Length,118.0,4.3,89
163,Women's Clothes,Coats & Jackets,,Wunder Puff Jacket,298.0,4.4,589
164,Women's Clothes,Underwear,,InvisiWear Mid-Rise Bikini Underwear,18.0,2.1,71
165,Women's Clothes,Coats & Jackets,,Always Effortless Jacket,158.0,4.4,65
166,Women's Clothes,Pants,Leggings,"Base Pace High-Rise Crop 23""",88.0,4.0,474
167,Women's Clothes,Shirts,Long Sleeve Shirts,Abrasion-Resistant Training Long-Sleeve Shirt,78.0,4.3,53
168,Women's Clothes,Hoodies & Sweatshirts,,Perfectly Oversized Cropped Crew French Terry,98.0,4.1,59
169,Women's Clothes,Shorts,,"Fast and Free Reflective High-Rise Classic-Fit Short 3""",78.0,,0
170,Women's Clothes,Shirts,T-Shirts,Team Canada Maple Leaf Love Crew T-Shirt COC Logo Online Only,48.0,4.6,97
171,Women's Clothes,Coats & Jackets,,Pack It Down Jacket Online Only,198.0,3.7,553
172,Women's Clothes,Pants,Sweatpants,lululemon Align™ High-Rise Cropped Jogger,108.0,4.1,1148
173,Women's Clothes,Shirts,,Sculpt Tank Top,64.0,4.3,1411
174,Women's Clothes,Underwear,,InvisiWear Mid-Rise Thong Underwear,18.0,2.5,81
175,Women's Clothes,Pants,Leggings,"lululemon Align™ High-Rise Pant 31""",98.0,3.8,1117
176,Women's Clothes,Underwear,,UnderEase Mid-Rise Bikini Underwear Online Only,18.0,3.4,42
177,Women's Clothes,Pants,Leggings,"lululemon Align™ High-Rise Mini Flared Pant 28""",128.0,4.1,31
178,Women's Clothes,Hoodies & Sweatshirts,,Perfectly Oversized Crew,108.0,3.5,2065
179,Women's Clothes,Pants,Leggings,"Fast and Free High-Rise Crop 23""",128.0,,0
180,Women's Clothes,Pants,Joggers,Stretch High-Rise Jogger Full Length,128.0,4.2,419
181,Women's Clothes,Coats & Jackets,,Rain Rebel Jacket,228.0,4.0,420
182,Women's Clothes,Pants,Leggings,"Groove Super-High-Rise Crop 23"" Nulu Online Only",128.0,4.1,84
183,Women's Clothes,Coats & Jackets,,Non-Stop Bomber Jacket Textured Online Only,168.0,4.2,166
184,Women's Clothes,Pants,Leggings,"Fast and Free High-Rise Crop 19""",128.0,4.0,784
185,Women's Clothes,Sweaters,,Rest Less Pullover Online Only,108.0,4.1,650
186,Women's Clothes,Coats & Jackets,,Seek Vistas Half-Zip Jacket Online Only,158.0,4.3,15
187,Women's Clothes,Coats & Jackets,,Push Your Pace Vest,148.0,4.4,8
188,Women's Clothes,Shirts,T-Shirts,Boxy Knit T-Shirt,98.0,4.0,3
189,Women's Clothes,Shirts,Long Sleeve Shirts,It's Rulu Run Half Zip,108.0,4.0,140
190,Women's Clothes,Hoodies & Sweatshirts,,Thick Fleece Half Zip,158.0,4.1,294
191,Women's Clothes,Shirts,Tank Tops,lululemon Align™ Ribbed Tank Top,78.0,4.5,79
192,Women's Clothes,Hoodies & Sweatshirts,,It's Rulu Run Cropped Half Zip Ribbed,118.0,4.8,33
193,Women's Clothes,Pants,Leggings,"lululemon Align™ Super-High-Rise Crop 21""",88.0,3.7,166
194,Women's Clothes,Skirts,,Pace Rival Mid-Rise Skirt Extra Long Online Only,78.0,4.2,266
195,Women's Clothes,Pants,Trousers,City Sleek 5 Pocket High-Rise Wide-Leg Pant Light Utilitech,138.0,3.9,296
196,Women's Clothes,Shirts,Tank Tops,Modal-Silk Yoga Tank Top,58.0,4.5,205
197,Women's Clothes,Coats & Jackets,,Another Mile Jacket Online Only,228.0,4.3,556
198,Women's Clothes,Pants,Leggings,"Swift Speed High-Rise Crop 21""",128.0,,0
199,Women's Clothes,Underwear,,InvisiWear Mid-Rise Bikini Underwear 3 Pack,48.0,3.0,113
200,Women's Clothes,Pants,Capris,Ready to Rulu High-Rise Cropped Jogger,108.0,,0
201,Women's Clothes,Pants,,"lululemon Align™ High-Rise Wide-Leg Pant 31""",138.0,4.3,221
202,Women's Clothes,Shirts,Long Sleeve Shirts,Rulu Running Long-Sleeve Mock Neck Shirt,108.0,4.0,16
203,Women's Clothes,Pants,Leggings,"Wunder Train Contour Fit High-Rise Crop 23""",88.0,4.0,122
204,Women's Clothes,Swimsuits,,Waterside Mid-Rise Swim Bottom Medium Bum Coverage Online Only,74.0,3.6,38
205,Women's Clothes,Coats & Jackets,,Pack It Down Long Jacket Online Only,248.0,3.7,530
206,Women's Clothes,Shirts,Bodysuits,Heavyweight Cotton T-Shirt Bodysuit Online Only,108.0,,0
207,Women's Clothes,Underwear,,UnderEase High-Rise Bikini Underwear,18.0,4.0,9
208,Women's Clothes,Pants,,Pull-On Zip-Front High-Rise Pant Full Length,158.0,,0
209,Women's Clothes,Shirts,Long Sleeve Shirts,It's Rulu Run Ribbed Long-Sleeve Shirt,108.0,4.7,41
210,Women's Clothes,Pants,Leggings,"Wunder Train High-Rise Tight 25"" Logo",118.0,4.8,5
211,Women's Clothes,Sports Bras,,"Like a Cloud Ribbed Longline Bra Light Support, D/DD Cup Online Only",74.0,4.7,13
212,Women's Clothes,Shirts,Tank Tops,Base Pace Ribbed Tank Top,58.0,3.9,161
213,Women's Clothes,Coats & Jackets,,Another Mile Vest Online Only,178.0,4.5,443
214,Women's Clothes,Hoodies & Sweatshirts,,Ribbed Luxtreme Wide-Sleeve Pullover,128.0,,0
215,Shoes,,,Chargefeel Mid Women's Workout Shoe,198.0,4.5,390
216,Women's Clothes,Shirts,Long Sleeve Shirts,Ebb to Street Long-Sleeve Shirt,88.0,3.9,229
217,Women's Clothes,Underwear,,"UnderEase Super-High-Rise Shortie Underwear 5""",28.0,4.5,150
218,Women's Clothes,Sweaters,,Open Back Half-Zip Sweater,138.0,4.4,11
219,Women's Clothes,Underwear,,UnderEase High-Rise Thong Underwear,18.0,3.8,30
220,Women's Clothes,Shirts,T-Shirts,Team Canada Love Crew T-Shirt COC Logo Online Only,48.0,4.4,97
221,Women's Clothes,Pants,,"Base Pace High-Rise Tight 31""",98.0,3.8,105
222,Women's Clothes,Shirts,Long Sleeve Shirts,Slim-Fit Jacquard Turtleneck,78.0,4.5,12
223,Women's Clothes,Shirts,Tank Tops,Swiftly Tech High-Neck Tank Top 2.0 Race Length,58.0,4.5,174
224,Women's Clothes,Shirts,T-Shirts,Back in Action Short-Sleeve T-Shirt Nulu Online Only,68.0,4.5,153
225,Women's Clothes,Underwear,,InvisiWear Mid-Rise Boyshort Underwear Online Only,20.0,3.6,40
226,Women's Clothes,Shirts,T-Shirts,Lightweight Cinched Hem Hiking T-Shirt Online Only,68.0,,0
227,Women's Clothes,Shirts,Long Sleeve Shirts,New Year Swiftly Tech Long Sleeve Shirt 2.0 Race Length Online Only,78.0,3.3,6
228,Women's Clothes,Pants,Leggings,"lululemon Align™ High-Rise Crop 23"" Shine",98.0,4.8,29
229,Women's Clothes,Underwear,,UnderEase Super-High-Rise Shortie Underwear 2 Pack,54.0,4.7,87
230,Women's Clothes,Hoodies & Sweatshirts,,It's Rulu Run Long-Sleeve Hoodie,118.0,4.1,17
231,Women's Clothes,Coats & Jackets,,Cross Chill Jacket,198.0,4.0,350
232,Women's Clothes,Coats & Jackets,,Dynamic Movement Half-Zip Online Only,168.0,3.9,25
233,Women's Clothes,Coats & Jackets,,Transformable Parka,368.0,4.3,26
234,Women's Clothes,Coats & Jackets,,Evergreen Anorak,158.0,4.3,118
235,Women's Clothes,Hoodies & Sweatshirts,,Mixed Fabric Full-Zip Hoodie,178.0,5.0,1
236,Women's Clothes,Pants,,Loungeful Straight Leg Pant Full Length,128.0,4.4,313
237,Women's Clothes,Coats & Jackets,,Short Insulated Bomber Jacket,198.0,5.0,2
238,Women's Clothes,Shorts,,"lululemon Align™ High-Rise Short with Pockets 6"" Online Only",74.0,4.2,47
239,Women's Clothes,Shirts,T-Shirts,Love V-Neck T-Shirt Online Only,48.0,3.6,379
240,Women's Clothes,Sweaters,,Cotton-Blend Full-Zip Sweater,198.0,5.0,3
241,Women's Clothes,Shorts,,"Team Canada lululemon Align™ High-Rise Short 8"" COC Logo Online Only",64.0,5.0,4
242,Women's Clothes,Pants,Leggings,"Fast and Free High-Rise Tight 25"" Neon Wash",148.0,4.5,4
243,Women's Clothes,Shorts,,"Track That High-Rise Lined Short 3""",68.0,4.4,848
244,Women's Clothes,Pants,Leggings,"Base Pace High-Rise Crop 17""",88.0,3.7,72
245,Women's Clothes,Hoodies & Sweatshirts,,Team Canada Swiftly Tech Half Zip 2.0 Online Only,108.0,4.2,5
246,Women's Clothes,bottoms,Underwear,UnderEase Lace Mid-Rise Bikini Underwear 3 Pack,48.0,,0
247,Women's Clothes,Shorts,,"Multi-Pocket Cargo High-Rise Hiking Short 5""",108.0,4.3,91
248,Women's Clothes,Swimsuits,,Waterside Pull-On Swim Top B/C Cup,74.0,3.0,3
249,Women's Clothes,Coats & Jackets,,Water-Repellent Stretch Tennis Jacket,178.0,5.0,5
250,Women's Clothes,Coats & Jackets,,Belted Rain Trench Coat,298.0,4.0,2
251,Women's Clothes,Coats & Jackets,,Wunder Puff Cropped Vest,228.0,4.6,381
252,Women's Clothes,Shirts,Long Sleeve Shirts,Team Canada Swiftly Tech Long-Sleeve Shirt 2.0,78.0,4.2,57
253,Women's Clothes,Underwear,,InvisiWear Mid-Rise Boyshort Underwear 3 Pack,54.0,3.8,23
254,Women's Clothes,Sports Bras,,"New Year lululemon Align™ Bra Light Support, A/B Cup",58.0,4.0,10
255,Women's Clothes,Swimsuits,,Waterside Half-Zip UV Protection Paddle Top,98.0,,0
256,Women's Clothes,Shorts,,"Softstreme High-Rise Short 4""",78.0,4.6,95
257,Women's Clothes,Pants,,"Everlux and Mesh Super-High-Rise Training Tight 25""",158.0,4.4,26
258,Women's Clothes,bottoms,Underwear,UnderEase Lace Mid-Rise Thong Underwear 3 Pack,48.0,,0
259,Women's Clothes,Coats & Jackets,,Rain Rebel Insulated Jacket Online Only,278.0,2.9,11
260,Shoes,,,Blissfeel Women's Running Shoe,198.0,4.3,2105
261,Women's Clothes,Underwear,,Invisiwear High-Rise Bikini Underwear,18.0,3.1,23
262,Women's Clothes,Hoodies & Sweatshirts,,Softstreme Turtleneck Pullover,138.0,3.8,75
263,Women's Clothes,Shirts,Long Sleeve Shirts,New Year Swiftly Tech Long Sleeve Shirt 2.0,78.0,4.1,1952
264,Women's Clothes,Coats & Jackets,,SenseKnit Composite Running Jacket,248.0,3.0,1
265,Women's Clothes,Shirts,Long Sleeve Shirts,Love Long-Sleeve Shirt,58.0,4.4,355
266,Women's Clothes,Swimsuits,,Waterside Scoop One-Piece Swimsuit,138.0,5.0,1
267,Women's Clothes,Pants,,"Relaxed-Fit High-Rise Knit Cropped Pants 24""",158.0,,0
268,Women's Clothes,Swimsuits,,Waterside High-Neck Back-Clasp One-Piece Swimsuit,138.0,,0
269,Women's Clothes,Coats & Jackets,,Evergreen Cropped Full-Zip Hoodie,148.0,4.9,15
270,Women's Clothes,Sweaters,,Cotton-Blend Ribbed Sweater,178.0,3.0,2
271,Women's Clothes,Coats & Jackets,,Always Effortless Trench Online Only,228.0,4.2,30
272,Women's Clothes,Pants,,"Wunder Train Contour Fit High-Rise Tight 28""",98.0,4.2,186
273,Women's Clothes,Coats & Jackets,,Evergreen Full-Zip Long Jacket,198.0,3.2,22
274,Women's Clothes,Shirts,Short Sleeve Shirts,Nulux Cropped Tennis Short-Sleeve Shirt,78.0,4.1,10
275,Women's Clothes,Underwear,,UnderEase High-Waist Ribbed Brief,22.0,4.7,3
276,Women's Clothes,Hoodies & Sweatshirts,,Swiftly Relaxed Half Zip Online Only,108.0,4.3,75
277,Women's Clothes,Pants,Leggings,"Wunder Train High-Rise Crop with Pockets 23"" Online Only",128.0,,0
278,Women's Clothes,Shirts,Short Sleeve Shirts,New Year Swiftly Tech Short Sleeve Shirt 2.0,68.0,4.4,2243
279,Women's Clothes,Underwear,,UnderEase High-Waist Ribbed Thong Underwear,20.0,4.7,7
280,Women's Clothes,Pants,Leggings,"New Year lululemon Align™ High-Rise Crop 23""",88.0,,0
281,Women's Clothes,Shirts,Tank Tops,Hold Tight Tank Top Jacquard,68.0,3.8,5
282,Women's Clothes,Skirts,,Asymmetrical Pleated Tennis Skirt,108.0,3.8,12
283,Women's Clothes,Sweaters,,Merino Wool-Blend Ribbed Long Wrap Sweater,158.0,4.1,155
284,Women's Clothes,Shirts,T-Shirts,Crescent T-Shirt,58.0,,0
285,Women's Clothes,Shirts,Short Sleeve Shirts,Swiftly Tech Short-Sleeve Shirt 2.0 Team Canada,68.0,,0
286,Women's Clothes,Pants,Leggings,"SenseKnit High-Rise Running Tight 28"" Online Only",178.0,3.9,78
287,Women's Clothes,Dresses,,"lululemon Align™ Bodysuit 25""",148.0,3.9,469
288,Women's Clothes,Shirts,Long Sleeve Shirts,Lightweight Hiking Long-Sleeve Henley,78.0,4.0,11
289,Women's Clothes,Pants,Leggings,"Cargo Super-High-Rise Hiking Tight 25""",148.0,4.1,87
290,Women's Clothes,Pants,Joggers,Scuba High-Rise Relaxed Jogger Full Length,128.0,4.1,165
291,Women's Clothes,Shirts,T-Shirts,New Year Cates T-Shirt Online Only,48.0,,0
292,Women's Clothes,Coats & Jackets,,Cross Chill Jacket RepelShell,198.0,4.1,413
293,Women's Clothes,Hoodies & Sweatshirts,,Ribbed Nulu Cropped Define Jacket,138.0,4.4,98
294,Women's Clothes,Pants,,Loungeful High-Rise Jogger Full Length,128.0,4.5,141
295,Women's Clothes,Underwear,,UnderEase Ribbed High-Waist Brief 3 Pack Online Only,54.0,4.3,6
